{
  "$schema": "https://json-schema.org/draft/2020-12/schema",
  "$id": "https://vehiclerecon.local/schemas/calibration.schema.json",
  "type": "object",
  "properties": {
    "schema_version": {
      "const": 1
    },
    "source": {
      "type": "string",
      "minLength": 1
    },
    "source_size": {
      "type": "array",
      "items": {
        "type": "integer",
        "minimum": 1
      },
      "minItems": 2,
      "maxItems": 2
    },
    "source_sha256": {
      "type": "string",
      "pattern": "^[0-9a-f]{64}$"
    },
    "views": {
      "type": "object",
      "properties": {
        "front": {
          "type": "object",
          "properties": {
            "origin": {
              "type": "array",
              "items": {
                "type": "number"
              },
              "minItems": 3,
              "maxItems": 3
            },
            "u_basis": {
              "type": "array",
              "items": {
                "type": "number"
              },
              "minItems": 3,
              "maxItems": 3
            },
            "v_basis": {
              "type": "array",
              "items": {
                "type": "number"
              },
              "minItems": 3,
              "maxItems": 3
            },
            "crop": {
              "type": "array",
              "items": {
                "type": "number"
              },
              "minItems": 4,
              "maxItems": 4
            },
            "landmarks": {
              "type": "object"
            },
            "plane_offset": {
              "type": "array",
              "items": {
                "type": "number"
              },
              "minItems": 3,
              "maxItems": 3
            },
            "camera": {
              "type": "object",
              "properties": {
                "name": {
                  "type": "string",
                  "minLength": 1
                },
                "position": {
                  "type": "array",
                  "items": {
                    "type": "number"
                  },
                  "minItems": 3,
                  "maxItems": 3
                },
                "target": {
                  "type": "array",
                  "items": {
                    "type": "number"
                  },
                  "minItems": 3,
                  "maxItems": 3
                },
                "scale": {
                  "type": "number",
                  "exclusiveMinimum": 0
                },
                "type": {
                  "enum": [
                    "ORTHO"
                  ]
                },
                "size": {
                  "type": "array",
                  "items": {
                    "type": "integer",
                    "minimum": 1
                  },
                  "minItems": 2,
                  "maxItems": 2
                }
              },
              "required": [
                "name",
                "position",
                "target",
                "scale"
              ],
              "additionalProperties": false
            }
          },
          "required": [
            "origin",
            "u_basis",
            "v_basis",
            "crop",
            "landmarks",
            "plane_offset",
            "camera"
          ],
          "additionalProperties": false
        },
        "side": {
          "type": "object",
          "properties": {
            "origin": {
              "type": "array",
              "items": {
                "type": "number"
              },
              "minItems": 3,
              "maxItems": 3
            },
            "u_basis": {
              "type": "array",
              "items": {
                "type": "number"
              },
              "minItems": 3,
              "maxItems": 3
            },
            "v_basis": {
              "type": "array",
              "items": {
                "type": "number"
              },
              "minItems": 3,
              "maxItems": 3
            },
            "crop": {
              "type": "array",
              "items": {
                "type": "number"
              },
              "minItems": 4,
              "maxItems": 4
            },
            "landmarks": {
              "type": "object"
            },
            "plane_offset": {
              "type": "array",
              "items": {
                "type": "number"
              },
              "minItems": 3,
              "maxItems": 3
            },
            "camera": {
              "type": "object",
              "properties": {
                "name": {
                  "type": "string",
                  "minLength": 1
                },
                "position": {
                  "type": "array",
                  "items": {
                    "type": "number"
                  },
                  "minItems": 3,
                  "maxItems": 3
                },
                "target": {
                  "type": "array",
                  "items": {
                    "type": "number"
                  },
                  "minItems": 3,
                  "maxItems": 3
                },
                "scale": {
                  "type": "number",
                  "exclusiveMinimum": 0
                },
                "type": {
                  "enum": [
                    "ORTHO"
                  ]
                },
                "size": {
                  "type": "array",
                  "items": {
                    "type": "integer",
                    "minimum": 1
                  },
                  "minItems": 2,
                  "maxItems": 2
                }
              },
              "required": [
                "name",
                "position",
                "target",
                "scale"
              ],
              "additionalProperties": false
            }
          },
          "required": [
            "origin",
            "u_basis",
            "v_basis",
            "crop",
            "landmarks",
            "plane_offset",
            "camera"
          ],
          "additionalProperties": false
        },
        "rear": {
          "type": "object",
          "properties": {
            "origin": {
              "type": "array",
              "items": {
                "type": "number"
              },
              "minItems": 3,
              "maxItems": 3
            },
            "u_basis": {
              "type": "array",
              "items": {
                "type": "number"
              },
              "minItems": 3,
              "maxItems": 3
            },
            "v_basis": {
              "type": "array",
              "items": {
                "type": "number"
              },
              "minItems": 3,
              "maxItems": 3
            },
            "crop": {
              "type": "array",
              "items": {
                "type": "number"
              },
              "minItems": 4,
              "maxItems": 4
            },
            "landmarks": {
              "type": "object"
            },
            "plane_offset": {
              "type": "array",
              "items": {
                "type": "number"
              },
              "minItems": 3,
              "maxItems": 3
            },
            "camera": {
              "type": "object",
              "properties": {
                "name": {
                  "type": "string",
                  "minLength": 1
                },
                "position": {
                  "type": "array",
                  "items": {
                    "type": "number"
                  },
                  "minItems": 3,
                  "maxItems": 3
                },
                "target": {
                  "type": "array",
                  "items": {
                    "type": "number"
                  },
                  "minItems": 3,
                  "maxItems": 3
                },
                "scale": {
                  "type": "number",
                  "exclusiveMinimum": 0
                },
                "type": {
                  "enum": [
                    "ORTHO"
                  ]
                },
                "size": {
                  "type": "array",
                  "items": {
                    "type": "integer",
                    "minimum": 1
                  },
                  "minItems": 2,
                  "maxItems": 2
                }
              },
              "required": [
                "name",
                "position",
                "target",
                "scale"
              ],
              "additionalProperties": false
            }
          },
          "required": [
            "origin",
            "u_basis",
            "v_basis",
            "crop",
            "landmarks",
            "plane_offset",
            "camera"
          ],
          "additionalProperties": false
        },
        "top": {
          "type": "object",
          "properties": {
            "origin": {
              "type": "array",
              "items": {
                "type": "number"
              },
              "minItems": 3,
              "maxItems": 3
            },
            "u_basis": {
              "type": "array",
              "items": {
                "type": "number"
              },
              "minItems": 3,
              "maxItems": 3
            },
            "v_basis": {
              "type": "array",
              "items": {
                "type": "number"
              },
              "minItems": 3,
              "maxItems": 3
            },
            "crop": {
              "type": "array",
              "items": {
                "type": "number"
              },
              "minItems": 4,
              "maxItems": 4
            },
            "landmarks": {
              "type": "object"
            },
            "plane_offset": {
              "type": "array",
              "items": {
                "type": "number"
              },
              "minItems": 3,
              "maxItems": 3
            },
            "camera": {
              "type": "object",
              "properties": {
                "name": {
                  "type": "string",
                  "minLength": 1
                },
                "position": {
                  "type": "array",
                  "items": {
                    "type": "number"
                  },
                  "minItems": 3,
                  "maxItems": 3
                },
                "target": {
                  "type": "array",
                  "items": {
                    "type": "number"
                  },
                  "minItems": 3,
                  "maxItems": 3
                },
                "scale": {
                  "type": "number",
                  "exclusiveMinimum": 0
                },
                "type": {
                  "enum": [
                    "ORTHO"
                  ]
                },
                "size": {
                  "type": "array",
                  "items": {
                    "type": "integer",
                    "minimum": 1
                  },
                  "minItems": 2,
                  "maxItems": 2
                }
              },
              "required": [
                "name",
                "position",
                "target",
                "scale"
              ],
              "additionalProperties": false
            }
          },
          "required": [
            "origin",
            "u_basis",
            "v_basis",
            "crop",
            "landmarks",
            "plane_offset",
            "camera"
          ],
          "additionalProperties": false
        }
      },
      "required": [
        "front",
        "side",
        "rear",
        "top"
      ],
      "additionalProperties": false
    },
    "perspective_camera": {
      "type": "object",
      "properties": {
        "name": {
          "type": "string",
          "minLength": 1
        },
        "position": {
          "type": "array",
          "items": {
            "type": "number"
          },
          "minItems": 3,
          "maxItems": 3
        },
        "target": {
          "type": "array",
          "items": {
            "type": "number"
          },
          "minItems": 3,
          "maxItems": 3
        },
        "scale": {
          "type": "number",
          "exclusiveMinimum": 0
        },
        "type": {
          "enum": [
            "ORTHO"
          ]
        },
        "size": {
          "type": "array",
          "items": {
            "type": "integer",
            "minimum": 1
          },
          "minItems": 2,
          "maxItems": 2
        }
      },
      "required": [
        "name",
        "position",
        "target",
        "scale"
      ],
      "additionalProperties": false
    },
    "uncertainty": {
      "type": "object"
    },
    "datums": {
      "type": "object"
    },
    "proof_layout": {
      "type": "object"
    },
    "wheel_geometry": {
      "type": "object",
      "properties": {
        "radius_m": {
          "type": "number",
          "exclusiveMinimum": 0
        },
        "axles": {
          "type": "array",
          "items": {
            "type": "object",
            "properties": {
              "id": {
                "type": "string",
                "minLength": 1
              },
              "x": {
                "type": "number"
              },
              "track_m": {
                "type": "number",
                "exclusiveMinimum": 0
              },
              "z": {
                "type": "number",
                "exclusiveMinimum": 0
              }
            },
            "required": [
              "id",
              "x",
              "track_m",
              "z"
            ],
            "additionalProperties": false
          }
        }
      },
      "required": [
        "radius_m",
        "axles"
      ],
      "additionalProperties": false
    }
  },
  "required": [
    "schema_version",
    "source",
    "source_size",
    "source_sha256",
    "views",
    "perspective_camera",
    "uncertainty",
    "datums",
    "proof_layout",
    "wheel_geometry"
  ],
  "additionalProperties": false
}
